{
  "$schema": "https://json-schema.org/draft/2020-12/schema",
  "$id": "medioevo.world_state.v0.1",
  "title": "WorldState",
  "type": "object",
  "required": ["schema_version", "world_id", "tick", "geography", "era", "climate", "astronomy", "culture", "laws", "resources", "events", "factions", "map_state", "active_stimuli", "boundary"],
  "properties": {
    "schema_version": { "const": "medioevo.world_state.v0.1" },
    "world_id": { "type": "string" },
    "tick": { "type": "integer" },
    "geography": { "type": "object" },
    "era": { "type": "object" },
    "climate": { "type": "object" },
    "astronomy": { "type": "object" },
    "culture": { "type": "object" },
    "laws": { "type": "object" },
    "resources": { "type": "object" },
    "events": { "type": "array" },
    "factions": { "type": "array" },
    "map_state": { "type": "object" },
    "active_stimuli": { "type": "array" },
    "boundary": { "type": "object" }
  },
  "additionalProperties": false
}

